Audit Timestamp,Corp Name,Client ID,Client Name,YL Status,Input URL,Desktop Unpaid CTN,Mobile Unpaid CTN,Desktop Paid CTN,Mobile Paid CTN,DB Unpaid CTN,Show Destination,DB Paid CTN,PPC,YL SSL Status,Final URL,Initial Status, Final Status,Final URL IP,Final URL NS,Analysis - Desktop Unpaid CTN,Analysis - Mobile Unpaid CTN,Analysis - Desktop Paid CTN,Analysis - Mobile Paid CTN,PPC Product,Session Tracking Code,Web Using SSL, Can SSL Be installed
2018-10-24 09:55:26,The Little Gym,25068,The Little Gym of Bay Ridge-Bensonhurst  NY,LIVE,http://thelittlegym.com/bayridgebensonhurstny/,718-259-6878,718-259-6878,718-514-6323,718-514-6323,No DB Unpaid Number,7185146323,PPC Not Found,0,https://www.thelittlegym.com/bayridgebensonhurstny/,301,200,199.7.215.131,ns37.worldnic.com.,no,no,yes,yes,PPC Not Found,yes,yes,no
2018-10-24 09:56:08,The Little Gym,51211,The Little Gym of Perinton-Pittsford NY,LIVE,http://thelittlegym.com/perintonpittsfordny/,No Desktop Unpaid Numbers,No Mobile Unpaid Numbers,585-310-1438,585-310-1438,No DB Unpaid Number,5853101438,PPC Not Found,0,https://www.thelittlegym.com/perintonpittsfordny/,301,200,199.7.215.131,ns37.worldnic.com.,no,no,yes,yes,PPC Not Found,yes,yes,no
2018-10-24 09:56:45,The Little Gym,59796,The Little Gym of Charlotte on Providence NC,LIVE,http://thelittlegym.com/charlotteonprovidencenc/,704)365-3838,704)365-3838,704-879-5238,704-879-5238,No DB Unpaid Number,7048795238,PPC Not Found,0,https://www.thelittlegym.com/charlotteonprovidencenc/,301,200,199.7.215.131,ns37.worldnic.com.,no,no,yes,yes,PPC Not Found,yes,yes,no
2018-10-24 09:57:22,The Little Gym,122501,The Little Gym of Jackson MS,LIVE,http://thelittlegym.com/jacksonms/,No Desktop Unpaid Numbers,No Mobile Unpaid Numbers,601-202-0072,601-202-0072,No DB Unpaid Number,6012020072,PPC Not Found,0,https://www.thelittlegym.com/jacksonms/,301,200,199.7.215.131,ns38.worldnic.com.,no,no,yes,yes,PPC Not Found,yes,yes,no
2018-10-24 09:57:57,The Little Gym,198141,The Little Gym - Ballantyne,LIVE,http://thelittlegym.com/ballantynenc/,980)237-3863,980)237-3863,980-222-1648,980-222-1648,No DB Unpaid Number,9802221648,PPC Not Found,0,https://www.thelittlegym.com/ballantynenc/,301,200,199.7.215.131,ns38.worldnic.com.,no,no,yes,yes,PPC Not Found,yes,yes,no
2018-10-24 09:58:31,The Little Gym,335212,The Little Gym of St. John's,LIVE,http://thelittlegym.com/stjohnsnl/,709-754-7672,709-754-7672,709-700-1152,709-700-1152,No DB Unpaid Number,7097001152,PPC Not Found,0,https://www.thelittlegym.com/stjohnsnl/,301,200,199.7.215.131,ns37.worldnic.com.,no,no,yes,yes,PPC Not Found,yes,yes,no
2018-10-24 09:59:07,The Little Gym,343005,The Little Gym of BroomfieldWestminster CO,LIVE,http://thelittle.com/westminsterco/,No Desktop Unpaid Numbers,No Mobile Unpaid Numbers,No Desktop Paid Numbers,No Mobile Paid Numbers,No DB Unpaid Number,No DB Paid Number,PPC Not Found,0,https://rep.myprivacykeeper.com/lps/index_12?cd=00251317p067709313926,302,200,96.45.83.233,ns1.dnsmadeeasy.com.,no,no,no,no,PPC Not Found,no,no,no
